pname,subtitle,StrDate,EndDate,production,crew,cast,content,cover,stills
A Tale of Two Cities,"by Charles Dickens 
 adapted by Ruth Ford 
 Directed by Roger Gimblett",2001-07-14,2001-08-25,"{""Asst. Director"": [""JOYCE BIRCH""], ""SM"": [""DIANE HENDERSON""]}","{""Set"": [""GRANT FRASER""], ""Set & lighting design"": [""OWEN GIMBLETT""], ""Sound Design"": [""JOHN O'BRIEN-HALL""]}","{""unknown"": [""STEVE ANDREWS"", ""GIL BALFAS"", ""LUKE BARTLETT"", ""JOHN BENJAMIN"", ""ERIC BICKNELL"", ""ANTHONY BURNS"", ""GARY DOOLEY"", ""WENDY GIMBLETT"", ""GEOFF HACKER"", ""CAROLEEN HEATON"", ""PETER HENSON"", ""TERESA HINTON"", ""EDDIE HYDE"", ""BILL LAMONBY"", ""FIONA LARDNER"", ""ROB McHUGH"", ""MARIE MERSNICH"", ""MEG MOONEY"", ""JASON MURDOCH"", ""JOEL SARAKULA"", ""FELICITY STEEL"", ""GRAHAM SWAN"", ""LORETTA TOLNAI"", ""GEORGE J. WRIGHT""], ""SHANE BATES"": [""The Vengeance""], ""SUSAN CARVETH"": [""Costumes""], ""DEL DINES"": [""Miss Pross""], ""BRIAN DONOVAN"": [""Dr Manette""], ""JOHANNE DONOVAN"": [""Lucy Manette""], ""RUTH FORD"": [""Adaption to play""], ""PAUL GILBERT"": [""Stage revolve""], ""ROGER GIMBLETT"": [""DIRECTOR""], ""PETER W. RYAN"": [""Stryver""], ""GARY WOODS"": [""Marquis""]}","Act One opens with Banker Mr Jarvis Lorry travelling to Paris to assume responsibility for his old client Dr Manette, recently released from 18 years imprisonment in the Bastille. He takes with him Lucie, Manette's daughter, who has never known her father. In Paris Dr Manette is being cared for by his old servant, wine-shop owner Ernest Defarge and his wife, Therese. The action then shifts to the Old Bailey, London, where 5 years later Charles Darnay is on trial as a suspected spy. Lorry, Dr Manette and Lucie are called as witnesses as they meet Darnay on the boat returning from France. Darnay is saved by his strange likeness to a lawyer called Sydney Carton, who works for Defence Counsel Mr Stryver. Soon Darnay, Stryver and Carton are all rivals for the affection of Lucie Manette. However she falls in love with, and marries, Darnaym although Carton, a dissolute cynic, has sworn his love and loyalty to her. Meanwhile the situation in France deteriorates, the peasants storm the Bastille, and overthrow the government. Darnay (who is actually the nephew and heir of a recently assasinated French aristocrat, the Marquis St. Evermonde) is summoned to Paris to save an old servant, Gabelle, who has been arrested by the new revolutionary government. Reluctantly and not fully realizing the danger, he sets out for France.
Act Two begins with Lucie and Dr Manette arriving in Paris and seeking out Mr Lorry who is working for the bank there. They have heard that Darnay has been arrested as an 'Emigre Aristocrat'. The next day, in the Revolutionary Tribunal, Dr Manette's status as a heroic Bastille prisoner saves his son-in-law from the guillotine. All seems well, until Darnay is almost immediately rearrested having been denounced with new information from an unknown source. Meanwhile Sydney Carton has arrived in Paris to do what he can to help Lucie and Darnay. He makes his own plans as Darnay appears again in the Revolutionary Tribunal where an ancient story is revealed which condemns Darnay to death. All seems lost.....but is it?",https://www.genesiantheatre.com.au/s2001/2/images/poster.jpg,"['https://www.genesiantheatre.com.au/s2001/2/images/2CITIES1.jpg', 'https://www.genesiantheatre.com.au/s2001/2/images/2CITIES2.jpg']"
Scotland Road,"by Jeffrey Hatcher 
 Directed by Timothy Bennett",2001-09-08,2001-10-20,{},"{""Set construction"": [""PAUL GILBERT""], ""Set"": [""PETER HICKEY""], ""Sound Design"": [""JOHN O'BRIEN-HALL""], ""Sound Opps."": [""PETER W. RYAN""]}","{""unknown"": [""STEVE ANDREWS"", ""SANDRA BASS"", ""ERIC BICKNELL"", ""GARY DOOLEY"", ""ANDREW FOXWORTH"", ""ROGER GIMBLETT"", ""WUNNDONNA HUGHES"", ""KEITH JENNINGS"", ""REBEKAH JENNINGS"", ""JANE KEMPLER"", ""CHERYL LAWSON"", ""TONY LEIGHTON"", ""MEG MOONEY"", ""JOHN PRESCOTT"", ""GEORGE J. WRIGHT""], ""TIMOTHY BENNETT"": [""DIRECTOR""], ""JOYCE BIRCH"": [""Frances Kittle""], ""SUSAN CARVETH"": [""Costumes""], ""ANNE EVERS"": [""Dr Halbrech""], ""GRANT FRASER"": [""thanks""], ""PAMELA WHALAN"": [""Thanks""], ""GARY WOODS"": [""Titanic Dinner""]}","'Scotland Road' is Jeffrey Hatcher's most produced play with stagings as far away as Santiago and Berlin. The idea for the play came about during an automobile trip from Colorado to Minnesota in August, 1991. During the trip Hatcher stopped at a gas station in the Badlands of South Dakota. While waiting to pay at the counter Hatcher looked down at a rack of tabloids and saw a headline on the cover of The Weekly World News, which read 'Titanic Survivor Found on Iceberg'. The paper told the story of a woman who had been found floating on an iceberg in the North Atlantic.
In an
In Theatre Magazine
 article, Hatcher said,""There are times when you go searching for a play idea. But on rare occasions, an idea will come galloping towards you unbidden, leaping at you like a wet yellow labrador, knocking you to the ground and licking your face until you begin to type. SCOTLAND ROAD came to me that way.""",https://www.genesiantheatre.com.au/s2001/3/images/poster.jpg,"['https://www.genesiantheatre.com.au/s2001/3/images/SCOTLAND1.jpg', 'https://www.genesiantheatre.com.au/s2001/3/images/SCOTLAND2.jpg']"
An Ideal Husband,"by Oscar Wilde 
 Directed by Paula Bate",2001-11-03,2001-12-15,{},"{""Set construction"": [""PAUL GILBERT""], ""Lighting opps"": [""GLEN HARMAN""]}","{""PAULA BATE"": [""DIRECTOR""], ""SHANE BATES"": [""Lady Markby""], ""unknown"": [""MEG CARROLL"", ""GEOFF HACKER"", ""PAMELA HIGGINS"", ""REBEKAH JENNINGS"", ""JENNI LYNCH"", ""JANNIE MATIK"", ""LUCY-JANE McELWEE"", ""MICHAEL O'CONNELL"", ""ANNE POWER"", ""ALEXANDER RIENECK"", ""KERRIE ROWE"", ""ALAN SCULLY"", ""HELENE SEDDON-GLASS"", ""MICHAEL STEDMAN"", ""BRENT THORPE"", ""DAVE WENT"", ""ANN WILLIAMS"", ""LINDA YOUNG""], ""SUSAN CARVETH"": [""Costumes""], ""BROOKE DAVIDSON"": [""Mrs Marchmont""], ""GRANT FRASER"": [""lights design & set""], ""MICHAEL GROGAN"": [""Hairstyles""], ""DIANE HENDERSON"": [""Costumes""], ""JOHN O'BRIEN-HALL"": [""Mr Montford""], ""KAREN O'BRIEN-HALL"": [""Thanks""]}","At Sydney's Genesian Theatre Company, on Saturday 3rd November 2001, at 8.00pm,the brilliant wit and elegant style of Oscar Wilde's An Ideal Husband will come tolife at Sydney's Unique Little Theatre.Set in the world of Victorian narrow-mindedness and complacency, An IdealHusband, under the expert guidance of Paula Bate, combines the drama of socialintrigue with witty high comedy. Once again Wilde brings together, one of hisfavourite themes, that of idealism verses public corruption.Robert Chiltern is a young successful politician, an incorruptible icon, who hasacquired wealths position and power through a social impropriety. We all know about""Insider Trading"" in the 20th Century; the amassing of huge personal fortunes, and thesocial acceptance and adulation that goes with it.
When Chiltern is faced with exposure he justifies his position ""What this centuryworships is wealth ... I have fought the century with its own weapons and won""Lord Caversham's final words to him are chilling, ""I congratulate you Chiltern. Ifthe country does not go to the dogs or the Radicals we shall have you as PrimeMinister, some day.""Those of you who frequent The Genesian Theatre or who may be visiting for the firsttime will be treated once again to the wonderful acting talent of our company, andalong with the splendid costumes and set, you are assured of a superb night of theatre.
An Ideal Husband has its preview Friday Nov 2nd at 8.00pm, and opens Saturday, 3rdNov at 8.00pm. It runs until Sat 15th Dec 2001 at the Genesian Theatre, 420 KentStreet, Sydney. Bookings through MCA ticketing 9873 3575.EndsFor media information and interview contact:Meg Mooney                                                             (02) 93375960",https://www.genesiantheatre.com.au/s2001/4/images/poster.jpg,"['https://www.genesiantheatre.com.au/s2001/4/images/HUSBAND1.jpg', 'https://www.genesiantheatre.com.au/s2001/4/images/HUSBAND2.jpg']"
Mansfield Park,"by Jane Austen 
 Adapted and directed by Pamela Whalan",2002-01-05,2002-02-23,"{""SM"": [""GLEN HARMAN""]}","{""Set"": [""GRANT FRASER""], ""Set construction"": [""PAUL GILBERT""]}","{""unknown"": [""STEVE ANDREWS"", ""STEVE ANDREWS"", ""GIL BALFAS"", ""TIMOTHY BENNETT"", ""ERIC BICKNELL"", ""HELEN CAMBOURN"", ""TRISH CHIGWIDDEN"", ""KEIRA DALEY"", ""PETER DUNSTAN"", ""PETER HENSON"", ""REBEKAH JENNINGS"", ""JENNIFER JOHNSON"", ""MARJORIE JONES"", ""JANE KEMPLER"", ""LUCIE-JANE McELWEE"", ""MATTHEW McWILLIAMS"", ""KIT MESSHAM-MUIR"", ""MEG MOONEY"", ""DARRAN MORAN"", ""JOHN PRESCOTT"", ""LORETTA TOLNAI"", ""ROBYN WILLIAMS""], ""SUSAN CARVETH"": [""Costumes""], ""DEL DINES"": [""thanks""], ""RUTH FORD"": [""Thanks""], ""PETER W. RYAN"": [""Voice Over""], ""PAMELA WHALAN"": [""DIRECTOR""]}","Adapted from Jane Austen's novel by Pamela WhalanIf you ever thought that Jane Austen wrote pretty little romances in which all live happily everafter, your introduction to the world of Mansfield Park will cause you to revise your opinion!Mansfield Park, written in 1813, draws us into the world of the three Ward sisters: one of whommarried well and became Lady Bertram of Mansfield Park; one of whom married to avoid beingan old maid and became Mrs Norris, wife of the local parson; and the youngest, who married ""todisoblige her family"" and became Mrs Price.
The calm, respectable world of Mansfield Park where Sir Thomas and Lady Bextram reside withtheir four children and Fanny, eldest daughter of the impoverished Mrs Price, is disrupted by thearrival in the district of the charming but worldly Crawfords. Henry Crawford flirts outrageouslywith the young women but are his intentions honourable? His sister Mary, beautiful andsophisticated, is attracted to the second son of the family as much as he is attracted to her, but canshe resign herself to be the wife of a country parson when she so much enjoys the pleasures ofLondon society? The rash conduct of the young people is observed acutely by poor relationFanny who is powerless to help, while those who should be guiding and advising are eitherabsent, fussing over trifles, or dozing peacefully by the fire.
The novel has been adapted for the stage by Austen scholar Pamola Whalan, who is also directingthis production. She works once more with set and costume designer Peter Henson. You mayremember the beautiful set and costumes he provided for Pamela's 2000 production of Emma.This production will be another visual treat.Mansfield Park: a play has its preview on Friday 4 January at 8.00pm, and opens Saturday 5January at 8.00pm. It runs for a season of Friday and Saturday evenings and Sunday matinees at4.30pm until Saturday 23 February 2002 at the Genesian Theatre, 420 Kent Street, Sydney.",https://www.genesiantheatre.com.au/s2001/5/images/poster.jpg,"['https://www.genesiantheatre.com.au/s2001/5/images/MANSFIELD1.jpg', 'https://www.genesiantheatre.com.au/s2001/5/images/MANSFIELD2.jpg']"
Merry Wives of Windsor,"by William Shakespeare 
 Directed by Gary Dooley",2002-03-09,2002-05-14,"{""Asst Director"": [""DEL DINES""], ""SM"": [""JOHN O'BRIEN-HALL""]}","{""Sound opps"": [""CORALIE ANNE FRASER""], ""Set construction"": [""PAUL GILBERT""]}","{""unknown"": [""SANDRA BASS"", ""ERIC BICKNELL"", ""BERNIE BUIKSTRA"", ""ROGER GIMBLETT"", ""JANE KEMPLER"", ""BILL LAMONBY"", ""NIGI LECHNER"", ""ROB McHUGH"", ""MEG MOONEY"", ""DARRAN MORAN"", ""KATHLEEN ROBERTSON"", ""TENNILLE SCICLUNA"", ""GORDON SMITH"", ""LORETTA TOLNAI"", ""GEORGE J. WRIGHT""], ""SHANE BATES"": [""Hostess of the Garter""], ""Ros BILBE"": [""Alice Ford""], ""JOYCE BIRCH"": [""Mistress Quickly""], ""SUSAN CARVETH"": [""Costumes""], ""GARY DOOLEY"": [""DIRECTOR""], ""ANNE EVERS"": [""Meg Page""], ""GRANT FRASER"": [""sound opps & photos""], ""FRANCES MILAT"": [""Continuity""], ""BARRY NIELSEN"": [""Pistol""], ""KAREN O'BRIEN-HALL"": [""PR""], ""PETER W. RYAN"": [""Sir John Falstaff""]}",,https://www.genesiantheatre.com.au/s2001/6/images/poster.jpg,"['https://www.genesiantheatre.com.au/s2001/6/images/WIVES1.jpg', 'https://www.genesiantheatre.com.au/s2001/6/images/WIVES2.jpg']"
Educating Rita,"by Willy Russell 
 Directed by Karen O'Brien-Hall",2000-05-20,2000-07-08,"{""SM"": [""CORALIE THEW""]}","{""Sound Design"": [""JOHN O'BRIEN-HALL""]}","{""unknown"": [""GREGORY BALCOMBE"", ""MONICA BRIAN"", ""BRENDON CLEARY"", ""CAROL CLEARY"", ""KATE HORSLEY"", ""BEN TRUELSEN""], ""SUSAN CARVETH"": [""Costumes""], ""JOHN FITZSIMMONS"": [""set design""], ""GRANT FRASER"": [""lights design & set""], ""KAREN O'BRIEN-HALL"": [""DIRECTOR""]}","Liverpool lad, Willy Russell, was born into a family with a strong tradition of storytelling. Leaving school at 15 armed with one ""O"" level, Russell had a vague idea of being a writer, but drifted into hairdressing and labouring before returning, in his 20's, to full time education.

This background, coupled with Russell's strong view on the working classes' attempt to gain access to middle class culture, are reflected in Educating Rita. Originally commissioned by the RSC, Educating Rita was successfully produced in the West End, winning the award for Best Comedy of 1980. Still freely available on video, Educating Rita was adapted by Russell for the Oscar nominated 1983 film starring Michael Caine and Julie Waters.

The Genesian Theatre production of Educating Rita marks the directing debut of Karen O'Brien-Hall, and brings together the talents of Gregory Balcombe, who last appeared at the Genesian Theatre in ""The Woman in Black""; and Monica Brian the delightful Viola in our production of ""Twelfth Night"". ",https://www.genesiantheatre.com.au/s2000/1/images/poster.jpg,"['https://www.genesiantheatre.com.au/s2000/1/images/RITA1.jpg', 'https://www.genesiantheatre.com.au/s2000/1/images/RITA2.jpg']"
An Inspector Calls,"by J.B. Priestly 
 Directed by Brian Donovan",2000-07-22,2000-09-09,{},"{""Lighting opps"": [""DIANE HENDERSON""], ""Sound Design"": [""JOHN O'BRIEN-HALL""]}","{""unknown"": [""ERIC BICKNELL"", ""MEG CARROLL"", ""GARY DOOLEY"", ""ROGER GIMBLETT"", ""CAROLEEN HEATON"", ""PETER HENSON"", ""BARRY JENKINS"", ""DAVE KIRKHAM"", ""GENEVIEVE LA ROSA"", ""ANN LESLIE"", ""JANET McCAULEY"", ""JASON MURDOCH"", ""JANET POOLE"", ""MARC. TAYLOR"", ""GEORGE J. WRIGHT""], ""BRIAN DONOVAN"": [""DIRECTOR""]}","An Inspector Calls
, by JB Priestly was first presented in London on 1st October 1946. It has the huge catatastophe of the First World War and the Second World War as its background.
The mysterious Inspector enters the lives of the Birling Family one evening, and shatters their middle class respectability in a society where greed and self interest have been permitted to flourish.
The Genesian Theatre production of
An Inspector Calls
 marks the return of Brian Donovan, after an absence of twenty years from the theatre. Brian Donovan's previous directing credits at The Genesian Theatre include,
The Alchemist
 by Ben Johnson in 1963, and
Murder in the Cathedral
 in 1980. Apart from his theatre work, he studied direction under a scholarship at both The Conservatorium Opera School and The Australian Opera in the nineteen seventies.
Those who frequent The Genesian Theatre will recognize the talents of Caroleen Heaton, Jason Murdoch and Marc Taylor, who are joined in a welcome return to our stage by Barry Jenkins and Dave Kirkham. We also welcome in their debut performance Anne Lesley and Janet McCauley.",https://www.genesiantheatre.com.au/s2000/2/images/poster.jpg,"['https://www.genesiantheatre.com.au/s2000/2/images/INSPECTOR1.jpg', 'https://www.genesiantheatre.com.au/s2000/2/images/INSPECTOR2.jpg']"
The Unexpected Guest,"by Agatha Christie 
 Directed by Joyce Birch",2000-10-28,2000-12-16,"{""SM"": [""JOHN O'BRIEN-HALL""]}","{""Set"": [""GRANT FRASER""]}","{""unknown"": [""SANDRA BASS"", ""TIMOTHY BENNETT"", ""ERIC BICKNELL"", ""D. ED BODDY"", ""MEG CARROLL"", ""GARY DOOLEY"", ""JIM MANNELL"", ""MATTHEW McWILLIAMS"", ""KIT MESSHAM-MUIR"", ""ASHLEIGH SHARMAN"", ""LORETTA TOLNAI"", ""ANDREW TRUMP""], ""JOYCE BIRCH"": [""DIRECTOR""], ""PAUL GILBERT"": [""Sgt Cadwallader""], ""KEITH POTTEN"": [""Insp Thomas""], ""PAMELA WHALAN"": [""Mrs Warwick & Costumes""]}","The Unexpected Guest by Agatha Christie, was first presented in London in 1958. It was, she said, with the exception of Witness for the Prosecution, the best play she had written.

One dark foggy night on a remote part of the Welsh coast, Michael Starkwedder, an engineer, home from the Persian Gulf, stumbles into a house, after running his car into a ditch and finds a dead man. Who is the murderer? Someone who resides in the house or an outsider seeking revenge?

Joyce Birch, well known Genesian Theatre identity, who was most recently seen as the tyrannical Mrs Boynton in Appointment with Death, returns to direct her 14th production with the theatre. Her previous directing credits include The Prime of Miss Jean Brodie in 1982, Gigi in 1986, and more recently Angels in Love in 1999.

She has gathered together a group of talented actors who bring to life anouther enduring Christie play with its usual famous surprise ending. ",https://www.genesiantheatre.com.au/s2000/3/images/poster.jpg,"['https://www.genesiantheatre.com.au/s2000/3/images/GUEST1.jpg', 'https://www.genesiantheatre.com.au/s2000/3/images/GUEST2.jpg']"
Ladies Who Lunch,"by Tudor Gates 
 Directed by Kate Horsley",2001-01-06,2001-02-24,"{""Asst Director"": [""GRAHAME DEIN""], ""SM"": [""KAREN O'BRIEN-HALL"", ""PAMELA WHALAN""]}",{},"{""unknown"": [""JULIE BARCLAY"", ""PAULA BATE"", ""ERIC BICKNELL"", ""MEG CARROLL"", ""KEIRA DALEY"", ""ANNE LEWIS"", ""BRIAN PARKER"", ""GEORGE PORTHOUSE"", ""MARGOT SMITHYMAN"", ""LORETTA TOLNAI"", ""CHRISTINE TROSS"", ""MATTHEW WYLIE""], ""KATE HORSLEY"": [""DIRECTOR""], ""FRANCES MILAT"": [""Mrs D L Wallis""], ""JOHN O'BRIEN-HALL"": [""Ken Stocks""]}","When I first read
""Ladies Who Lunch""
 something struck me immediately. How easy it seems to make millions of dollars on the money markets. I need a career change!!!
Then I started thinking that vast amounts of money are traded daily, billions are gained (and lost) every second. Ah, then why if it's possible to accumulate such wealth so quickly is poverty so prevalent?? It's a childish notion, I know, but the loose change we as individuals donate to charity seems insignificant in comparison to the amounts discussed in the play. It's a simple question but a hard one to answer. The world's wealth is in the hands of a small few. Perhaps Amelia is right, we do need a few more modern day Robin Hoods!!
The play itself does not attempt to solve the problem, but what it does make us see, through the characters and their relationships is the age-old adage that money cannot buy happiness. This is the focus of the play's action and you are invited to observe each character's obsession, as each has to address the reality of their lives.
For the play may seem to be about money..... but underneath what it is really about is people.",https://www.genesiantheatre.com.au/s2000/4/images/poster.jpg,"['https://www.genesiantheatre.com.au/s2000/4/images/LADIES1.jpg', 'https://www.genesiantheatre.com.au/s2000/4/images/LADIES2.jpg']"
Silhouette,"by Simon Brett 
 Directed by Roger Gimblett",2001-03-10,2001-05-05,"{""Asst. Director"": [""JOYCE BIRCH""], ""SM"": [""PAMELA WHALAN""]}","{""Set"": [""GRANT FRASER""], ""Set design"": [""OWEN GIMBLETT""], ""Sound Design"": [""JOHN O'BRIEN-HALL""]}","{""unknown"": [""STEVE ANDREWS"", ""PAULA BATE"", ""TIMOTHY BENNETT"", ""ERIC BICKNELL"", ""GARY DOOLEY"", ""RAY FORSYTH"", ""NEIL GRIGG"", ""REBEKAH JENNINGS"", ""JANE KEMPLER"", ""ROBERT MATEK"", ""KIT MESSHAM-MUIR"", ""MEG MOONEY"", ""MICHAEL O'CONNELL"", ""SIOBHAN PATRICK"", ""DARREN POTTER"", ""KERRIE ROWE"", ""MICHAEL RUSSELL"", ""LORETTA TOLNAI"", ""GEORGE J. WRIGHT""], ""SUSAN CARVETH"": [""Costumes""], ""BRIAN DONOVAN"": [""Thanks""], ""ROGER GIMBLETT"": [""DIRECTOR""], ""BARRY NIELSEN"": [""Inspoector Brunton""], ""GARY WOODS"": [""Speciality Makeup""]}","The play
Silhouette
, was first presented at Guildford, England in 1997, and is one of many works written by popular English Television and mystery writer Simon Brett. It tells the story of Celia Wallis (Kerri Rowe) a middle aged actress estranged from her Shakespearian actor husband (Michael O'Connell). When he is found dead the finger of suspicion points in many directions, not least at the young journalist (Darren Potter) who is asleep in Celia's bed.....
Inspector Bruton (Barry Nielson) investigates but finds that even his own officers (Robert Matek, Meg Carrol, Ray Forsyth) seem to know rather too much about this ultimate celebrity couple. A witty modern thriller with an unexpected twist this play breathes new life into the murder mystery genre.
Roger Gimblett, last seen as Roy in 'Cosi' with Phoenix theatre makes his directing debut for the Genesian Theatre. He has previously directed extensively in New Zealand and the UK.
This play is a must see for lovers of crime, comedy and mystery.

",https://www.genesiantheatre.com.au/s2000/5/images/poster.jpg,"['https://www.genesiantheatre.com.au/s2000/5/images/SILHOUETTE1.jpg', 'https://www.genesiantheatre.com.au/s2000/5/images/SILHOUETTE2.jpg']"
Castle in the Air,"by Alan Melville 
 Directed by Timothy Bennett",1999-01-09,1999-02-20,"{""Production assistant"": [""JOYCE BIRCH""]}","{""Lights Design"": [""GRANT FRASER""], ""Set construction"": [""PAUL GILBERT""], ""Lighting opps"": [""DIANE HENDERSON""]}","{""unknown"": [""STEVE ANDREWS"", ""STEVE ANDREWS"", ""WARREN BARNARD"", ""TIMOTHY BENNETT"", ""KOORYN BENTLEY"", ""SIMON BRAZZALOTTO"", ""MARTIN BRETHERICK"", ""CAROL CLEARY"", ""JANET FOWLER"", ""ROSE FRASCA"", ""STUART GREENFIELD"", ""WUNNDONNA HUGHES"", ""MADI JALIL"", ""MICHAEL KERAMEAS"", ""GENEVIEVE LA ROSA"", ""JENNI LYNCH"", ""JANE McCULLOCH CRIBB"", ""IAN McGREGOR"", ""PAUL OLISLAGERS"", ""MICHAEL PARR"", ""HELEN ROBINSON"", ""BEN TRUELSEN"", ""KAY WHITE""], ""TIMOTHY BENNETT"": [""DIRECTOR""], ""SUSAN CARVETH"": [""Costumes""], ""DEL DINES"": [""Thanks""], ""RUTH FORD"": [""Artwork & props""], ""JOHN O'BRIEN-HALL"": [""Thanks""], ""PETER W. RYAN"": [""Research""], ""PAUL TREACY"": [""Menzies""], ""PAMELA WHALAN"": [""Costumes""], ""GARY WOODS"": [""Poster design""]}","Alan Melville was a successful writer of revues in the 1940's He was also a witty playwright and some of his notable successes include ""Simon and Laura"" and ""Dear Charles"".
Cast: Paul Treacy, Jennifer Lynch, Stuart Greenfield, Ian McGregor, Janet Fowler",https://www.genesiantheatre.com.au/s1999/1/images/poster.jpg,"['https://www.genesiantheatre.com.au/s1999/1/images/CASTLE1.jpg', 'https://www.genesiantheatre.com.au/s1999/1/images/CASTLE2.jpg', 'https://www.genesiantheatre.com.au/s1999/1/images/CASTLE3.jpg']"
Appointment With Death,"by Agatha Christie 
 Directed by Pamela Whalan",1999-03-06,1999-05-01,{},"{""Sound Opperator"": [""JOHN O'BRIEN-HALL""]}","{""SHANE BATES"": [""Nadine Boynton""], ""Ros BILBE"": [""Lady Westholme""], ""JOYCE BIRCH"": [""Mrs Boynton""], ""unknown"": [""DANIEL BIRD"", ""SIMON BRAZZALOTTO"", ""HELEN CAMBOURNE"", ""MEG CARROLL"", ""PHILLIPA COLEMAN"", ""MISTY FISHER"", ""NEIL GRIGG"", ""ROGER HIND"", ""GENEVIEVE LA ROSA"", ""KEITH McILROY"", ""MATTHEW McWILLIAMS"", ""TONY MORGAN"", ""PAUL OLISLAGERS"", ""JANET POOLE"", ""GEORGE PORTHOUSE"", ""LORETTA TOLNAI"", ""CHRISTINE TROSS""], ""DEL DINES"": [""Voice coach""], ""PAUL GILBERT"": [""Lennox Boynton""], ""BARRY NIELSEN"": [""Raymond Boynton""], ""KAREN O'BRIEN-HALL"": [""Annabel Pryce""], ""PAMELA WHALAN"": [""DIRECTOR""], ""GARY WOODS"": [""Dr. Theodore Gerard""]}","Mystery. Mayhem. Madness......Murder!
All ingredients come together in Agatha Christie's, ""Appointment with Death"".
Set in 1935, the play takes us to the exotic location of Petra. On holiday are a famous doctor, a young female intern, two would-be politicians and a secretive American family, headed by their domineering stepmother. When the stepmother is found dead, there are many who gain and few who mourn, but until the murderer is found, all holiday-goers must live under suspicion.
Was it the son? Was it the doctor? Was it the family friend? This first class mystery keeps you guessing 'til the very unexpected end.
Cast: George Porthouse, Tony Morgan, Joyce Birch, Misty Fisher, Shane Bates, Paul Gilbert, Matthew McWilliams, Ros Bilbe, Karen O'Brien-Hall, Gary Woods, Phillipa Coleman, Daniel Bird, Barry Nielsen, Paul Olislagers, Keith McIlroy",https://www.genesiantheatre.com.au/s1999/2/images/poster.jpg,"['https://www.genesiantheatre.com.au/s1999/2/images/APPOINTMENT1.jpg', 'https://www.genesiantheatre.com.au/s1999/2/images/APPOINTMENT2.jpg', 'https://www.genesiantheatre.com.au/s1999/2/images/APPOINTMENT3.jpg']"
