pname,subtitle,StrDate,EndDate,production,crew,cast,content,cover,stills
The 39 Steps,"Adapted by Patrick Barlow 
 From the novel by John Buchan 
 From the movie of Alfred Hitchcock 
 Directed by Tom Massey 
 The Genesian Theatre was pleased to donate $2000 in box office takings from the Opening Night of  
 The 39 Steps 
  to the  
 Red Cross 
  to help provide aid to the people affected by the 2011 Tohoku earthquake and tsunami.",2011-05-14,2011-06-25,"{""Director:"": [""Tom Massey""], ""Assistant Director:"": [""Nanette Frew""], ""Set Design:"": [""Tom Massey""], ""Costume Design:"": [""Susan Carveth & Nicola Griggs""], ""Lighting & Sound Design:"": [""Michael Schell""], ""Production Manager:"": [""Roger Gimblett""]}","{""Stage Manager:"": [""Adam Campbell""], ""Assistant Stage Manager:"": [""Victoria Hoffman""], ""Lighting & Sound Operation:"": [""Mark Banks""]}","{""Richard Hannay:"": [""Max Philipson""], ""Annabella / Pamela / Margaret:"": [""Lib Campbell""], ""Clown:"": [""Stephen Holland""]}","Alfred Hitchcock's film of John Buchan's classic adventure novel is brought to life on the Genesian stage in this hilarious spoof from Patrick Barlow. Bored colonial Richard Hannay is thrust into the thrilling world of international espionage when the beautiful Annabella dies in his arms, a knife in her back. Suspected of her murder he flees from the police to the Scottish moors on the track of a vicious gang of spies.
The movie is a thriller, the play is a farce. At face perhaps an apparent contradiction, but of  course there is always a very fine line between the two. Crank up the tension of a thriller a notch and it immediately becomes a comedy.
That is largely what makes this play work - Hannay is a little bit more dashing, rugged and handsome, the women he meets are a little bit more beautiful and enticing, the villians even more evil and dastardly. Everything larger than life and theatrical, as after all befits a movie that is placed on stage.
With a very talented cast of four presenting several hundred characters backed up by a highly experienced production team, this fast moving farce is sure to prove hugely entertaining!
By special arrangement with Dominie Pty Ltd",https://www.genesiantheatre.com.au/s2011/1/images/poster.jpg,"['https://www.genesiantheatre.com.au/s2011/1/images/1.jpg', 'https://www.genesiantheatre.com.au/s2011/1/images/2.jpg']"
Northanger Abbey,"By Jane Austen 
 Adapted by Matthew Francis 
 Directed by Carissa Teeling",2011-07-09,2011-08-20,"{""Director:"": [""Carissa Teeling""], ""Assistant Director:"": [""Debbie Smith""], ""Set Design:"": [""Owen Gimblett""], ""Costume Design:"": [""Nicola Griggs""], ""Lighting Design:"": [""Timothy M Carter""], ""Sound Design:"": [""Carissa Teeling""], ""Production Manager:"": [""Roger Gimblett""]}","{""Stage Manager:"": [""Amy Roberts""], ""Sound & Lighting Operation:"": [""Susan Lafford-Jacob"", ""Jess Zapelli""]}","{""Catherine Morland:"": [""Sam Prior""], ""Isabella Thorpe:"": [""Tiffany C Stoecker""], ""John Thorpe:"": [""Thomas Greader""], ""Mrs Allen:"": [""Meg Mooney""], ""Annette:"": [""Jane Thorpe""], ""Henry Tilney:"": [""Ray Mainsbridge""], ""Mrs Morland / Mrs Thorpe:"": [""Penny Day""], ""Eleanor Tilney:"": [""Justine Kacir""], ""James Morland:"": [""Nicholas Pond""], ""Mr Morland:"": [""Jon Prowse""], ""General / Montoni / Dimity:"": [""Mark Nagle""]}","If you're looking to be stimulated, entertained, or even to just relax for an evening and forget the world that lines five days of your week then I can't advise Northanger Abbey strongly enough. - Rose Hodson, Australian Stage

...a good, if quiet way to spend a wintry Saturday evening. Or any other night of the week. - Brad Syke, Crikey

Highly diverting, and I'd really recommend the theatre. - Kirribilli Kim

Download a PDF flyer.

Matthew Francis' adaptation of Jane Austen's Northanger Abbey is a fast paced journey of the naive, novel reading heroine Catherine Morland. Catherine's journey takes us on an adventure between her fantasy world of the gothic novel Udolpho and the reality of her new societal life in Bath, where we meet characters of seemingly faithful friendships and of tragic beguiled influence.

But as these two worlds head toward an inevitable clash it is her hero Mr Tilney that awakens her to the wisdom of ""we mustn't allow what we read to effect how we behave"". Together with traditional Regency dancing, Venetian mask work and stage and lighting effects this play will be a delightful theatrical experience.",https://www.genesiantheatre.com.au/s2011/2/images/poster.jpg,"['https://www.genesiantheatre.com.au/s2011/2/images/1.jpg', 'https://www.genesiantheatre.com.au/s2011/2/images/2.jpg']"
The Mousetrap,"By Agatha Christie 
 Directed by Barry Nielsen",2011-09-01,2011-10-15,"{""Director:"": [""Barry Nielsen""], ""Assistant Director:"": [""Laura Genders""], ""Set Design:"": [""Owen Gimblett""], ""Costume Design:"": [""Nicola Griggs"", ""Susan Carveth""], ""Lighting Design:"": [""Timothy M Carter""], ""Sound Design:"": [""Michael Schell""], ""Production Manager:"": [""Roger Gimblett""]}","{""Stage Manager:"": [""Janina Olmos-New"", ""Laura Genders""], ""Sound & Lighting Operation:"": [""Wendy Greenfield"", ""Rivka Morley""]}","{""Molly Ralston:"": [""Elizabeth Gibney""], ""Giles Ralston:"": [""Michael Dowling""], ""Christopher Wren:"": [""Alexander Frank""], ""Mrs Boyle:"": [""Shane Bates""], ""Major Metcalf:"": [""Noel Camilleri""], ""Leslie Casewell:"": [""Dani Gross""], ""Mr Paravicini:"": [""Cheyne Fynn""], ""Sgt Trotter:"": [""Sebastian Wang""]}","An atmospheric, colourful night in the theatre - David Kary, Sydney Arts Guide

Download a PDF flyer.

On a cold winter's night no one was stirring, not even a mouse. No one that is, but a murderer in the house.

The most famous 'whodunit' in the world finally comes to downtown Sydney. In a new worldwide release, the longest running play in the world, Agatha Christie's Mousetrap opens September 3rd at the Genesian Theatre, the established home of mystery and murder.

Trapped in a blizzard, phone lines down, roads blocked, the unlucky occupants of a suitably isolated guesthouse are unsure of their fate but sure of one thing, someone has murder on their mind.

What dark secrets do they share?

What has brought them together in this place?

Who will survive?

Someone will die.

Make sure you don't ever tell whodunit.

Bookings essential.",https://www.genesiantheatre.com.au/s2011/3/images/poster.jpg,[]
An Ideal Husband,"By Oscar Wilde 
 Directed by Timothy Bennett 
 Opening Night Sold Out!",2011-10-29,2011-12-10,"{""Director:"": [""Timothy Bennett""], ""Assistant Director:"": [""Lilianna Komljenovic""], ""Set Design:"": [""Owen Gimblett""], ""Costume Design:"": [""Peter Henson""], ""Lighting Design:"": [""Mark Banks""], ""Sound Design:"": [""Tom Massey""], ""Production Manager:"": [""Roger Gimblett""]}","{""Stage Manager:"": [""Caroline Gage""], ""Lighting & Sound Operation:"": [""Frances Attard"", ""Emma Medbury""]}","{""Sir Robert Chiltern:"": [""Andrew O'Connell""], ""Lady Gertrude Chiltern:"": [""Faran Martin""], ""Lord Arthur Goring:"": [""John Willis-Richards""], ""Mrs Laura Cheveley:"": [""Melanie Robinson""], ""Lord Caversham:"": [""Gary Woods""], ""Miss Mabel Chiltern:"": [""Jodie Lee Behrendorff""], ""Lady Markby:"": [""Sandra Bass""], ""Lady Olivia Basildon:"": [""Lyndal Judges""], ""Mrs Margaret Marchmont:"": [""Georgina Lloyd""], ""Vicomte De Nanjac:"": [""Christophe Truschel""], ""Mr Montford:"": [""Jason Thorne""], ""Duchess of Maryborough:"": [""Joyce Birch""], ""Phipps:"": [""Jareth Norman""], ""Mason:"": [""Simon Frame""]}","a warm, entertaining night at the theatre. Oscar Wilde's wit reigns supreme! - David Kary, Sydney Arts Guide

An Ideal Husband is a clever blend of comedy and drama superbly crafted with Oscar Wilde's customary flair and sharp, satirical and timeless wit.

A successful politician's career, honour and marriage are threatened when he is confronted with blackmail over a past misdeed. Wilde quickly establishes an intriguing plot and with an array of colourful characters and sparkling dialogue the story flows at a brisk pace.

Wilde's observations on power, morals, human frailities, marriage, politics and honour are still fresh today. His polished writing and sparkling repartee have lost none of their appeal and guarantee an evening of satisfying and entertaining theatre. The costumes for the production will be designed by Peter Henson and will ensure that Wilde's wit is matched with a handsome and stylish recreation of the period.",https://www.genesiantheatre.com.au/s2011/4/images/poster.jpg,['https://www.genesiantheatre.com.au/s2011/4/images/1.jpg']
Terra Nova,"By Ted Tally 
 Directed by Mark Langham",2012-01-14,2012-02-04,"{""Director:"": [""Mark Langham""], ""Technical Director:"": [""Owen Gimblett""], ""Set Design:"": [""Owen Gimblett""], ""Costume Design:"": [""Susan Carveth""], ""Lighting & Sound Design:"": [""Michael Schell""]}","{""Stage Manager:"": [""Mark Banks""], ""Assistant Stage Manager:"": [""Victoria Hoffman"", ""Katherine Lee""], ""Lighting & Sound Operator:"": [""Lauren Churm""]}","{""Captain Robert Falcon \""Con\"" Scott, RN:"": [""Roger Gimblett""], ""Roald Amundsen:"": [""Tom Massey""], ""Kathleen Scott:"": [""Flora Milne""], ""Dr Edward \""Uncle Bill\"" Wilson:"": [""James Moir""], ""Lieutenant Henry \""Birdie\"" Bowers, RIM:"": [""Sam Ryan""], ""Petty Officer 1st Cl. Edgar \""Taff\"" Evans, RN:"": [""Michael Sydes""], ""Captain Lawrence \""Titus\"" Oates, Army:"": [""Jack Wieczorek""]}","his is about as good as amateur (and Genesian) productions get and I can barely imagine a professional one managing too much better - lloyd bradford (brad) syke, Australian Stage

Intriguingly written, powerful theatre, and Genesians' production tells its story unflinchingly, effectively and movingly. - Neil Litchfield, Stage Whispers

very competent, and well performed - David Kary, Sydney Arts Guide

Captain Scott's epic, and ultimately fatal, final adventure is the true stuff of legend. Following his own brand of muscular Christianity, Scott led his men towards what he believed to be his pre-ordained destiny - pre-eminence at the South Pole. Ted Tally's insightful play examines whether one of recent history's most epic failures was a result of bad luck, bad planning or, as some historians believe, the final act in Scott's doomed existence.

In the centenary of their death, the play looks at the character of the men who lived and died in the Antarctic wastes and shows the human face of a fateful journey.

On 17 January 1912 Captain Robert Scott and his team arrived at the South Pole. To mark the centenary of that achievement, on Tuesday 17 January 2012 the Genesian Theatre will be presenting a gala performance of Terra Nova, all tickets $40 including complimentary drinks, supper, and a guest speaker. Book Here for this gala performance!",https://www.genesiantheatre.com.au/s2011/5/images/poster.jpg,['https://www.genesiantheatre.com.au/s2011/5/images/1.jpg']
The Merchant of Venice,"By William Shakespeare 
 Directed by Constantine Costi",2012-02-18,2012-03-31,"{""Director"": [""Constantine Costi""], ""Assistant Director"": [""Michael Costi""], ""Set Design"": [""John Harrison""], ""Costume Design"": [""Alice Joel""], ""Lighting Design"": [""Michael Schell""]}","{""Stage Manager"": [""Adriane White""], ""Lighting & Sound Operator"": [""Amy Roberts"", ""James Thorne""]}","{""Shylock"": [""Geoff Sirmai""], ""Antonio"": [""Andy Fraser""], ""Portia"": [""Tiffany C. Stoecker""], ""Nerissa"": [""Emily Sheehan""], ""Jessica"": [""Harriet Gordon Anderson""], ""Bassanio"": [""Arragon"", ""Stephen Lloyd-Coombs""], ""Gratiano"": [""Ray Mainsbridge""], ""Lorenzo"": [""Morocco"", ""Brendan Cain""], ""Launcelot Gobbo"": [""Solanio"", ""Jasper Garner Gore""], ""Salerio"": [""Serena Weatherall""], ""Duke"": [""Tubal"", ""Dimitri Armatas""]}","there is a lot to like about this production - Jodi McAlister Australian Stage

A well realised night of Shakespeare - David Kary Sydney Arts Guide

genuinely fresh and inspired - Jacqui Dent Arts Hub

highly recommend you find time to see this performance - Jacky B Weekend Notes

most will appreciate the new life Shakespeare's play has been given - Jane Simmons SOYP

This stylish production stays with you many days after you've left the theatre - David Spicer Stage Whispers

lively and provocative one, with strong performances across the board - Lloyd Bradford Syke Crikey

a pleasure to attend and was an engaging interaction with the text - Kevin Jackson

Download a PDF flyer.

During the production of The Merchant of Venice a charity night was held and we had great pleasure in donating more than $1300 in boxoffice takings to Caritas. We would like to thank all who attended and helped us make this donation. Details about Caritas and the Project Compassion Appeal can be found at www.caritas.org.au.

In Shakespeare's Venice wild carnivals are held, money is thrown around and lovers fiendishly disguise themselves. The city and its rollicking citizens are extravagant and verging on the grotesque. Caught in the middle of this whirlwind of scandal and festivity are Antonio and Shylock. They are floating through surreal circumstances, displaced, angry and bound by a wager of flesh. Shylock is brutally persecuted and made evil. Antonio is disenchanted and recklessly assists Bassanio, trying to find a place in the new world.

The Merchant and the Money Lender are at odds with each other and yet, are somehow united as both are losing their grip in a Venice that is sinking into economic, cultural and judicial madness.

A delirious comedy, a dark fable, this heartbreaking tale of loss, love and revenge will be unmissable.
",https://www.genesiantheatre.com.au/s2011/6/images/poster.jpg,"['https://www.genesiantheatre.com.au/s2011/6/images/1.jpg', 'https://www.genesiantheatre.com.au/s2011/6/images/2.jpg', 'https://www.genesiantheatre.com.au/s2011/6/images/3.jpg']"
Pygmalion,"By George Bernard Shaw 
 Directed by Owen Gimblett",2010-05-08,2010-06-19,"{""Director:"": [""Owen Gimblett""], ""Set Design:"": [""Owen Gimblett""], ""Costume Design:"": [""Nicola Griggs""], ""Lighting & Sound Design:"": [""Michael Schell""]}","{""Stage Manager:"": [""Caroline Gage""], ""Assistant Stage Manager:"": [""Zehra Jemal""], ""Lighting & Sound Operation:"": [""Amy Roberts""]}","{""Eliza Doolittle:"": [""Carissa Teeling""], ""Henry Higgins:"": [""Roger Gimblett""], ""Col Pickering:"": [""Timothy Bennett""], ""Alfred Doolittle:"": [""Mark Langham""], ""Mrs Higgins:"": [""Ros Bilbe""], ""Mrs Pearce:"": [""Anne Evers""], ""Clara:"": [""Justine Kacir""], ""Freddy:"": [""Leon Joseph""], ""Mrs Eynsford-Hill:"": [""Jane Thorpe""], ""Parlour Maid:"": [""Susan Carveth""], ""Bystander:"": [""Zehra Jemal""]}","'I want to be a lady in a flower shop stead of selling at the corner of Tottenham Court Road. But they won't take me unless I can talk more genteel. He said he could teach me. Well, here I am ready to pay him--not asking any favor--and he treats me as if I was dirt.'
If ever a play deserved the title 'classic', the first offering of our season is that play! Based on the classical Greek myth,
Pygmalion
 has delighted audiences for generations as it plays on the complex business of human relationships in a class-based Society. When Professor Henry Higgins comes across a poor and uneducated Cockney girl named Eliza Doolittle he makes a bet that he can take Eliza from the gutters of London and pass her off as a society lady, by simply teaching her the right dialect in which to speak. The one thing he overlooks is that his ""creation"" has a mind of her own.
Shaw's brilliant comedy is of course well known as the source of the hit musical
My Fair Lady
 but those who have seen the musical shouldn't assume they know the play. Recently revived to huge acclaim in London by Sir Peter Hall and on Broadway starring Claire Danes, Shaw's incisive wit drives this timeless, utterly charming comedy.
Directed by New Zealand based Director and set designer Owen Gimblett and with sumptuous costuming from Nicola Griggs we invite you to come back to London in 1912 and discover that learning how to speak 'proper' is just one step on the journey to becoming a 'fair lady'.
""Gimblett's production serves Shaw's witty satire well"" SYDNEY ARTS GUIDE
""Roger Gimblett (Higgins) & Carissa Teeling (Eliza) ... practically faultless in their roles"" CRIKEY
""set design ... nothing short of astounding"" OZBABYBOOMERS",https://www.genesiantheatre.com.au/s2010/1/images/poster.jpg,"['https://www.genesiantheatre.com.au/s2010/1/images/1.jpg', 'https://www.genesiantheatre.com.au/s2010/1/images/2.jpg', 'https://www.genesiantheatre.com.au/s2010/1/images/3.jpg']"
Dead White Males,"By David Williamson 
 Directed by Tom Massey 
 OPENING NIGHT SOLD OUT",2010-07-03,2010-08-07,"{""Director:"": [""Tom Massey""], ""Assistant Director:"": [""Shane Bates""], ""Set Design:"": [""Catherine Lock""], ""Costume Design:"": [""Susan Carveth""], ""Lighting Design:"": [""Eric Bicknell""], ""Sound Design:"": [""Tom Massey""]}","{""Stage Manager:"": [""Dee Read""], ""Lighting Operation:"": [""Janina Olmos-New""], ""Sound Operation:"": [""Kathy Curran""]}","{""Angela Judd:"": [""Sophie Blacklaw""], ""William Shakespeare:"": [""David Woodland""], ""Grant Swain:"": [""Matt Jones""], ""Melissa:"": [""Emily Potts""], ""Steve:"": [""Matthew Blackwood Hume""], ""Col Judd:"": [""Marty O'Neill""], ""Grace Judd:"": [""Golda Baker""], ""Martin Judd:"": [""Enrico Babic""], ""Sarah Judd:"": [""Julie Zimmerman""], ""Jessica Squires:"": [""Meg Mooney""], ""Monica Judd:"": [""Karenza Stevens""]}","Opening with a literal depiction of Roland Barthes Death of the Author,
Dead White Males
 positions itself with a bang! as David Williamson's entry into the debate on literary theory which came to a head in the mid 1990's.
Dead White Males
 brings us into the life of Angela, a young woman trying to find her place in the world. Her studies at uni open up new intellectual horizons, and the possibility of new relationships. Will Shakespeare or Sartre, Dickens or Derrida, finally claim her heart?
This delicious satire of literary theory goes beyond the university walls, bringing us a touching study into three generations of an Australian family, all depicted by Williamson with his usual wisdom and wit.
The Genesian Theatre would like to suggest Parental Guidance for this production. It contains brief coarse language and mild themes.
""This Williamson piece sees the playwright fired up and committed, and this comes across strongly in Massey's production."" - David Kary, Sydney Arts Guide
By arrangement with the Cameron Creswell Agency",https://www.genesiantheatre.com.au/s2010/2/images/poster.jpg,"['https://www.genesiantheatre.com.au/s2010/2/images/1.jpg', 'https://www.genesiantheatre.com.au/s2010/2/images/2.jpg']"
And Then There Were None,"By Agatha Christie 
 Directed by Debbie Smith 
 OPENING NIGHT SOLD OUT",2010-08-21,2010-10-02,"{""Director:"": [""Jenny Jacobs""], ""Set Design:"": [""Debbie Smith""], ""Costume Design:"": [""Nicola Griggs and Susan Carveth""], ""Lighting & Sound Design:"": [""Michael Schell""]}","{""Stage Manager:"": [""Chris Wood""], ""Lighting & Sound Operation:"": [""Lisa Harrison""], ""Janina Olmos-New"": [], ""Lizzie Gibson"": [], ""Kathy Curran"": [], ""Merry Tran"": []}","{""Mr Rogers:"": [""Stewart Stubbs""], ""Narracot:"": [""Paul Barbary""], ""Mrs Rogers:"": [""Jessica Mestre""], ""Captain Philip Lombard:"": [""Michael Faustmann""], ""Ms Vera Claythorne:"": [""Lizzie Petrie""], ""Mr Anthony Marsden:"": [""Alec Hartnell""], ""Detective Blore:"": [""Jon Prowse""], ""General Mackenzie:"": [""Rod Stewart""], ""Ms Emily Blunt:"": [""Prudence Vindin""], ""Sir Lawrence Wargrave:"": [""Robert Drew""], ""Dr Edwina Armstrong:"": [""Clare Martin""], ""The Voice:"": [""Paul Gilbert""]}","Move over Miss Marple, it's now the audience's turn to solve the most popular murder mystery thriller of all time.

This play has captured theatre-goers around the world with its lively characters, bizarre series of murders and gripping climax. It is the story of ten individuals having a weekend retreat in a beautiful mansion on a remote island. But they soon realize that it's no holiday... as each person has a shady past and something to hide. One of them is lying, and committing the most dastardly murders. Is it the doctor, the judge, the cad, the spinster or the butler? And can the intended victims solve the rhyme and be able to save themselves in time?

Set in the elegant and sensual 1940s, the costumes are designed by Nicola Griggs, the nautically-themed set by Debbie Smith and the Lighting and Sound design is the creative work of Michael Schell. This show will be a feast for all the senses, especially the nerves. However the clever script also has lots of humour as it keeps you on your toes as you try to solve the puzzle.

You will be 'thrilled' by the Genesian Theatre production of And Then There Were None. Prepare yourself for a shockingly fun night of theatre!",https://www.genesiantheatre.com.au/s2010/3/images/poster.jpg,"['https://www.genesiantheatre.com.au/s2010/3/images/1.jpg', 'https://www.genesiantheatre.com.au/s2010/3/images/2.jpg']"
The Glass Menagerie,"By Tennessee Williams 
 Directed by Timothy M Carter",2010-10-16,2010-11-13,"{""Director:"": [""Timothy M Carter""], ""Associate Director:"": [""Chris Smith""]}","{""Stage Manager:"": [""Caroline Gage""], ""Assistant Stage Manager:"": [""Adriane White""], ""Lighting & Sound Operator:"": [""Rachel Coleman""]}","{""Tom Wingfield:"": [""Michael Sutherland""], ""Amanda Wingfield:"": [""Katherine Shearer""], ""Laura Wingfield:"": [""Kristie Jane Hogan""], ""Jim O'Connor:"": [""Andrew O'Connell""]}","Originally written for screen under the name The Gentleman Caller by Tennessee Williams, The Glass Menagerie premiered in Chicago in 1944 to critical acclaim. With a cast of four this is an evocative play which brings to light the struggles of each character and the way in which they reconcile their desire for their dreams and their duty to family.

Tom Wingfield takes us through his memories on a journey which identifies many social and family themes which are as relevant today as they were in St Louis, 1937. He is oppressed by his obligation to his family since the father walked out on them - a crippled sister (Laura) who has become an ascetic and a mother (Amanda) who is determined to marry her off while reliving her own memories of being a Southern Belle with many gentlemen callers.

This season's production of The Glass Menagerie will provide the Genesian Audience an opportunity to explore personal demons and the world we create to find security and comfort, and conflict between an inherent sense of duty and the desire to follow one's dreams.",https://www.genesiantheatre.com.au/s2010/4/images/poster.jpg,"['https://www.genesiantheatre.com.au/s2010/4/images/1.jpg', 'https://www.genesiantheatre.com.au/s2010/4/images/2.jpg']"
Black Comedy,"By Peter Shaffer 
 Directed by Pamela Whalan 
 Due to popular demand we are pleased to announce an extra matinee performance of  
 Black Comedy 
  on Saturday 11th December 2010 at 4.30pm. 
 Horizons 
 A new one-act play by Roger Gimblett",2010-11-27,2010-12-12,"{""Director"":[Pamela Whalan],""Assistant to the Director"":[""Derek Loh""],""Set Design"":[""Debbie Smith""],""Costume Design"":[""Susan Carveth""],""Lighting Design"":[""Eric Bicknell""],""Sound Design"":[""Tom Massey""]}","{""Stage Manager:"": [""Frances Etheridge""], ""Lighting and Sound Operator:"": [""Amy Roberts""]}","{""Brindsley Miller"":[""Matthew Orchard""],""Carol Melkett"":[""Justine Kacir""],""Miss Furnival"":[""Lisa Harrison""],""Colonel Melkett"":[""Bill Lamonby""],""Harold Gorringe"":[""Daniel Felkai""],""Clea"":[""Paula Searle""],""Franz Schuppanzig"":[""Patrick Matijevic""],""Georg Bamberger"":[""Derek Loh""]}","What really happens when the lights go out?
It is the ""swinging sixties"" and a young sculptor wants to impress a wealthy art collector. His current girlfriend wants him to impress her father. They ""borrow"" some furniture from the flat across the hall but their plans fall into chaos when the building is plunged into darkness by an electrical fault, the neighbour returns early from his holiday, the sculptor's former girlfriend arrives to renew their relationship and the prim spinster from the upstairs flat seeks refuge from the dark.
This witty farce, written by Peter Shaffer - author of
Amadeus
 and
Equus
 - is just the kind of light-hearted romp to put you in the mood for the Christmas season.
By arrangement with Dominie Pty Ltd
Horizons will be the curtain raiser to Black Comedy.
This little gem of a one-act play was first performed in a very successful season at the Tap Gallery in October 2009. It is a gentle and beautiful piece which is by turns moving, comic and true.
Set on a beach in Noosa on a summer's afternoon, it is the story of Liz (a prickly character in her sixties, clearly used to a position of power) who is taking some time out from her hectic life, for reasons which become apparent. On the beach she meets a beautiful young male surfer (Chris) and in the course of one short afternoon's conversation the two manage to share some secrets and surprises.",https://www.genesiantheatre.com.au/s2010/5/images/poster.jpg,['https://www.genesiantheatre.com.au/s2010/5/images/1.jpg']
